<?xml version="1.0" encoding="UTF-8"?>
<!-- Une valeur de trop dans les métadonnées -->
<sae:archivageUnitaire xmlns:sae="http://www.cirtil.fr/saeService" xmlns:xsi="http://www.w3.org/2001/XMLSchema-instance" xsi:schemaLocation="http://www.cirtil.fr/saeService ..\SaeService.xsd">
	<sae:ecdeUrl>ecde://ecde.cer69.recouvt/contrat_service/20110524/numTraitement/documents/monFichier.txt</sae:ecdeUrl>
	<sae:metadonnees>
		<sae:metadonnee>
			<sae:code>mon_code</sae:code>
			<sae:valeur>ma_valeur</sae:valeur>
		</sae:metadonnee>
		<sae:metadonnee>
			<sae:code>mon_code2</sae:code>
			<sae:valeur>ma_valeur2</sae:valeur>
		</sae:metadonnee>
		<sae:metadonnee>
			<sae:code>mon_code3</sae:code>
			<sae:valeur>ma_valeur3</sae:valeur>
			<sae:valeur>ma_valeur3</sae:valeur>
		</sae:metadonnee>
	</sae:metadonnees>
</sae:archivageUnitaire>
